{
  "schema": "iii.configuration-package/v1",
  "manifest_id": "9deb2cf03f56d2c3fa2ea3b88b7b4c0ae25a2b0a32bd1a0c2f6e0a5bc398cf14",
  "package_version": "2.2.0",
  "configuration_schema_version": 1,
  "compatibility": {
    "readable": {
      "minimum": 1,
      "maximum": 1
    },
    "upgrade_from": {
      "minimum": 1,
      "maximum": 1
    },
    "downgrade_from": {
      "minimum": 1,
      "maximum": 1
    }
  },
  "artifacts": [
    {
      "path": "configuration-package.schema.json",
      "sha256": "3209bc330fb413b65deb7c016fd464931baf296fe09dfc8b8e3c6835a609a877"
    },
    {
      "path": "migrations.json",
      "sha256": "766e054dff06317c6231ed5c1faeef67f639eb774a5ba015ea5c9bcf7809f02e"
    },
    {
      "path": "profiles.json",
      "sha256": "23801644c7632304fa5dedea08aa8f821dbdac4e6b6ba0b577f487f635f7132e"
    },
    {
      "path": "schema/parameter_manifest.yaml",
      "sha256": "e6cd02d210d6860a0d274d2fb2dca5d50b3a5e34e032e8c27d848f88484645c2"
    },
    {
      "path": "tracked_defaults/real/default.yaml",
      "sha256": "15d6ec74218d461eac01e7267b5faaa36340f467c8797470ddacb4916bed8405"
    },
    {
      "path": "tracked_defaults/sim/default.yaml",
      "sha256": "c05eae93cbefdee7440ed9af1a769ecef1ce0f2cbc9cc53ba6bc2a646d2a6781"
    }
  ],
  "tracked_sets": [
    {
      "profile": "real",
      "set_id": "default",
      "default": true,
      "path": "tracked_defaults/real/default.yaml",
      "sha256": "15d6ec74218d461eac01e7267b5faaa36340f467c8797470ddacb4916bed8405"
    },
    {
      "profile": "sim",
      "set_id": "default",
      "default": true,
      "path": "tracked_defaults/sim/default.yaml",
      "sha256": "c05eae93cbefdee7440ed9af1a769ecef1ce0f2cbc9cc53ba6bc2a646d2a6781"
    }
  ]
}
